date,headline,source,date_day,trading_date
2020-04-02 20:00:00,General Motors And Honda To Jointly Develop Honda Electric Vehicles Powered By GM's Ultium Batteries,kaggle_analyst_analyst_ratings_processed.csv,2020-04-02,2020-04-02
2020-04-02 19:02:00,Tesla Is Still A 'Maximum Short' For Chanos,kaggle_analyst_analyst_ratings_processed.csv,2020-04-02,2020-04-02
2020-04-02 16:31:00,Chanos Says Tesla Short Still One Of His Favorite Positions,kaggle_analyst_analyst_ratings_processed.csv,2020-04-02,2020-04-02
2020-04-02 18:55:00,"Tesla shares are trading lower, potentially amid continued concerns over lower deliveries.",kaggle_analyst_analyst_ratings_processed.csv,2020-04-02,2020-04-02
2020-04-02 16:27:00,Short-seller Chanos Says He Is Still Maximum Short On Tesla,kaggle_analyst_analyst_ratings_processed.csv,2020-04-02,2020-04-02
2020-04-02 14:21:00,Elon Musk's SpaceX Bans Employee Use Of Zoom: Report,kaggle_analyst_analyst_ratings_processed.csv,2020-04-02,2020-04-02
2020-04-02 10:56:00,"Tesla Can Help With Lithium-Ion Batteries For Its Ventilators, Says ResMed's CEO",kaggle_analyst_analyst_ratings_processed.csv,2020-04-02,2020-04-02
2020-04-02 00:00:00,"Dow Jones Futures: After Strong Market Rally, Tesla Leaps On Q1 Deliveries, But These 4 Leaders Eye Buy Points",massive_raw_partner_headlines,2020-04-02,2020-04-02
2020-04-02 00:00:00,"Thinking about trading options or stock in Boeing, Walt Disney, Darden Restaurants, Tesla, or ...",massive_raw_partner_headlines,2020-04-02,2020-04-02
2020-04-02 00:00:00,General Motors and Honda to Jointly Develop Next-Generation Honda Electric Vehicles Powered by ...,massive_raw_partner_headlines,2020-04-02,2020-04-02
2020-04-02 16:28:00,Chanos Says Tesla Is Increasing Capacity At 'Exactly The Wrong Time',kaggle_analyst_analyst_ratings_processed.csv,2020-04-02,2020-04-02
2020-04-03 15:00:00,Tesla Analysts Dissect 'Surprisingly Strong' Q1 Deliveries Data,kaggle_analyst_analyst_ratings_processed.csv,2020-04-03,2020-04-03
2020-04-03 14:14:00,'Tesla Software Update Allows In-Car Viewing Of Sentry Mode Videos' -InsideEVs,kaggle_analyst_analyst_ratings_processed.csv,2020-04-03,2020-04-03
2020-04-03 11:21:00,Tesla shares are trading higher after the company reported strong Q1 delivery and production figures.,kaggle_analyst_analyst_ratings_processed.csv,2020-04-03,2020-04-03
2020-04-03 00:00:00,ETFs to Ride High on Tesla's Robust Q1 Delivery Numbers,massive_raw_partner_headlines,2020-04-03,2020-04-03
2020-04-03 00:00:00,Why Eaton Vance (EV) is a Top Dividend Stock for Your Portfolio,massive_raw_partner_headlines,2020-04-03,2020-04-03
2020-04-03 00:00:00,"Woodstock Corp Buys Vanguard FTSE Emerging Markets, FibroGen Inc, Tesla Inc, Sells Ubiquiti ...",massive_raw_partner_headlines,2020-04-03,2020-04-03
2020-04-03 03:49:00,"Tesla Is 'Crushing The Auto Industry', Munster Says, As Company Posts Q1 Delivery Figures",kaggle_analyst_analyst_ratings_processed.csv,2020-04-03,2020-04-03
2020-04-06 21:00:00,'Tesla is making improvements to Fremont factory — increasing Model Y production capacity' -Electrek,kaggle_analyst_analyst_ratings_processed.csv,2020-04-06,2020-04-06
2020-04-06 13:39:00,"Jefferies Upgrades Tesla, Says Company Is 'Doubling Market Coverage With Model Y'",kaggle_analyst_analyst_ratings_processed.csv,2020-04-06,2020-04-06
2020-04-06 11:58:00,"Jefferies Upgrades Tesla to Buy, Lowers Price Target to $650",kaggle_analyst_analyst_ratings_processed.csv,2020-04-06,2020-04-06
2020-04-06 11:37:00,Tesla shares are trading higher after analysts at Jefferies upgraded the company's stock from Hold to Buy.,kaggle_analyst_analyst_ratings_processed.csv,2020-04-06,2020-04-06
2020-04-06 08:41:00,Jefferies Upgrades Tesla from Hold to Buy; Lowers Price Target from $800 to $650,kaggle_analyst_analyst_ratings_processed.csv,2020-04-06,2020-04-06
2020-04-06 00:00:00,Tesla (TSLA) Q1 Deliveries Impress Despite Coronavirus Crisis,massive_raw_partner_headlines,2020-04-06,2020-04-06
2020-04-04 13:50:00,"'Fast Money' Traders Weigh In On AT&T, Tesla And Twitter",kaggle_analyst_analyst_ratings_processed.csv,2020-04-04,2020-04-06
2020-04-06 08:44:00,Tesla Shows 'Car Parts-Based' Ventilator Prototype For Coronavirus Pandemic,kaggle_analyst_analyst_ratings_processed.csv,2020-04-06,2020-04-06
2020-04-07 00:00:00,"Thinking about trading options or stock in Costco, Walt Disney, Marriott International, Tesla, ...",massive_raw_partner_headlines,2020-04-07,2020-04-07
2020-04-07 09:20:00,Tesla Nearing Debut of Longer Range China-made Model 3,kaggle_analyst_analyst_ratings_processed.csv,2020-04-07,2020-04-07
2020-04-07 10:45:00,"Tesla shares are trading higher, potentially on reports the company plans to debut a new Model 3 in China as well as the company's progress on ventilator production. Movement also likely related to overall market strength.",kaggle_analyst_analyst_ratings_processed.csv,2020-04-07,2020-04-07
2020-04-07 15:56:00,'Tesla prepares to increase the price of 'Full Self-Driving' again with new features' -Electrek,kaggle_analyst_analyst_ratings_processed.csv,2020-04-07,2020-04-07
2020-04-07 19:09:00,Why Tesla's Stock Is Trading Higher Today,kaggle_analyst_analyst_ratings_processed.csv,2020-04-07,2020-04-07
2020-04-08 00:00:00,"Top Research Reports for Tesla, Zoetis, Target",massive_raw_partner_headlines,2020-04-08,2020-04-08
2020-04-08 00:00:00,Tesla Plans Pay Cuts & Worker Furloughs on Coronavirus Crisis,massive_raw_partner_headlines,2020-04-08,2020-04-08
2020-04-08 03:17:00,"'Tesla will slash employee pay, and will furlough hourly workers until May 4' -CNBC",kaggle_analyst_analyst_ratings_processed.csv,2020-04-08,2020-04-08
2020-04-08 06:12:00,"Tesla Furloughs All Non-Essential Workers In The US, Others To Get Pay Cut",kaggle_analyst_analyst_ratings_processed.csv,2020-04-08,2020-04-08
2020-04-08 09:24:00,"Tesla Announces Pay Cuts, Furloughs; Aims to Get Back to Production By May 4",kaggle_analyst_analyst_ratings_processed.csv,2020-04-08,2020-04-08
2020-04-08 16:10:00,Tesla to Furlough Hourly Workers at U.S. Car Plans Amid Coronavirus Shutdown; Hopes to Resume U.S. Car Production May 4,kaggle_analyst_analyst_ratings_processed.csv,2020-04-08,2020-04-08
2020-04-08 16:11:00,Hearing Tesla Hopes To Resume U.S. Car Production May 4,kaggle_analyst_analyst_ratings_processed.csv,2020-04-08,2020-04-08
2020-04-09 17:28:00,"Tesla shares are trading higher amid overall market strength following a Fed loan program and optimism towards a coronavirus recovery. The company reportedly sold 10,160 units in China in March.",kaggle_analyst_analyst_ratings_processed.csv,2020-04-09,2020-04-09
2020-04-09 00:00:00,"The Zacks Analyst Blog Highlights: Tesla, Zoetis, Target, Boston Scientific and Moody's",massive_raw_partner_headlines,2020-04-09,2020-04-09
2020-04-09 09:49:00,"Tesla Sold 10,160 Units in China in March",kaggle_analyst_analyst_ratings_processed.csv,2020-04-09,2020-04-09
2020-04-10 00:00:00,"Stock Market Today: Mexico Joins OPEC+ Production Deal, Tesla's China Moves, Delta Cut To Junk, Intel, Taiwan Semiconductor Sales Strong",massive_raw_partner_headlines,2020-04-10,2020-04-13
2020-04-10 00:00:00,"Coronavirus Stock Market Rally: Mexico Joins OPEC+ Production Deal, Tesla's China Moves, Delta Cut To Junk, Intel, Taiwan Semiconductor Sales Strong",massive_raw_partner_headlines,2020-04-10,2020-04-13
2020-04-10 12:11:00,Why Tesla Might Have The 'Competitive Advantage' Post-Pandemic,kaggle_analyst_analyst_ratings_processed.csv,2020-04-10,2020-04-13
2020-04-10 13:39:00,"Tesla  Says Starts Selling Locally-made Long-range Model 3 Vehicles in China to be Priced at 339,050 Yuan After Subsidies; Locally-made Performance Model 3 to be Priced at 419,800 Yuan",kaggle_analyst_analyst_ratings_processed.csv,2020-04-10,2020-04-13
2020-04-11 13:50:00,Mike Khouw Sees Unusual Options Activity In Tesla,kaggle_analyst_analyst_ratings_processed.csv,2020-04-11,2020-04-13
2020-04-13 00:00:00,Coronavirus Stock Market Rally: Dow Jones Futures Higher Ahead Of Earnings Season Kickoff; Tesla Spikes Late,massive_raw_partner_headlines,2020-04-13,2020-04-13
2020-04-13 00:00:00,"Sellers Hit Dow Jones, But FANG Stock Scores Bullish Breakout; Tesla, Amazon Also Soar",massive_raw_partner_headlines,2020-04-13,2020-04-13
2020-04-13 09:29:00,Tesla Furlough Has Hit New Workers In Delivery And Sales The Worst: Report,kaggle_analyst_analyst_ratings_processed.csv,2020-04-13,2020-04-13
2020-04-13 12:01:00,"Tesla shares are trading higher following a media report that the company is now producing all Chinese Model 3s in China, meaning vehicles are not subject to import tax.",kaggle_analyst_analyst_ratings_processed.csv,2020-04-13,2020-04-13
2020-04-13 15:28:00,"'Elon Musk: Tesla's upcoming event will focus on batteries, not powertrain — 'a lot to talk about'' -Electrek",kaggle_analyst_analyst_ratings_processed.csv,2020-04-13,2020-04-13
2020-04-14 17:55:00,'Tesla is still getting tons of Cybertruck orders months after electric pickup unveiling' -Electrek,kaggle_analyst_analyst_ratings_processed.csv,2020-04-14,2020-04-14
2020-04-14 17:06:00,Here's How Long It Took Tesla To Reach A $100B Market Cap,kaggle_analyst_analyst_ratings_processed.csv,2020-04-14,2020-04-14
2020-04-14 11:48:00,Tesla Striving To Cut Costs By Seeking Rent Relief As Coronavirus Affects Business,kaggle_analyst_analyst_ratings_processed.csv,2020-04-14,2020-04-14
2020-04-14 03:33:00,Why Tesla's Stock Traded 17% Higher On Monday,kaggle_analyst_analyst_ratings_processed.csv,2020-04-14,2020-04-14
2020-04-14 09:50:00,"Credit Suisse Upgrades Tesla to Neutral, Raises Price Target to $580",kaggle_analyst_analyst_ratings_processed.csv,2020-04-14,2020-04-14
2020-04-14 00:00:00,"Dow Jones Today, Futures Jump; Nasdaq's Bullish Signal; Tesla, Vertex Rally: J&J, JPMorgan Rise On Earnings",massive_raw_partner_headlines,2020-04-14,2020-04-14
2020-04-14 10:17:00,Tesla shares are trading higher after Credit Suisse analysts upgraded the company's stock from Underperform to Neutral and raised their price target from $415 to $580.,kaggle_analyst_analyst_ratings_processed.csv,2020-04-14,2020-04-14
2020-04-15 21:47:00,"Tesla To Report Q1 Earnings Wed., Apr. 29 After Market Close",kaggle_analyst_analyst_ratings_processed.csv,2020-04-15,2020-04-15
2020-04-15 20:24:00,Steve Grasso Says Tesla Has 'Defied All Laws Of Probability',kaggle_analyst_analyst_ratings_processed.csv,2020-04-15,2020-04-15
2020-04-15 12:26:00,"Cramer Advises His Viewers On Alcoa, Xerox, Tesla And More",kaggle_analyst_analyst_ratings_processed.csv,2020-04-15,2020-04-15
2020-04-15 11:27:00,Startup Zoox Acknowledges Some Employees Were In Possession Of Tesla Confidential Information,kaggle_analyst_analyst_ratings_processed.csv,2020-04-15,2020-04-15
2020-04-15 10:19:00,Tesla shares are trading higher after Goldman Sachs initiated coverage on the company's stock with a Buy rating and $864 price target. The company also reported China registrations rose in March.,kaggle_analyst_analyst_ratings_processed.csv,2020-04-15,2020-04-15
2020-04-15 09:27:00,"Goldman Sachs Initiates Coverage On Tesla with Buy Rating, Announces Price Target to $864",kaggle_analyst_analyst_ratings_processed.csv,2020-04-15,2020-04-15
2020-04-15 09:21:00,"Tesla's China Registrations Rose to 12,709 Units in March vs 2,314 in February",kaggle_analyst_analyst_ratings_processed.csv,2020-04-15,2020-04-15
2020-04-15 12:37:00,Tesla China Car Registrations Buck Industry Slump In March,kaggle_analyst_analyst_ratings_processed.csv,2020-04-15,2020-04-15
2020-04-15 00:35:00,Zoox and Tesla Settle Lawsuit; Zoox to Make Payment to Tesla,kaggle_analyst_analyst_ratings_processed.csv,2020-04-15,2020-04-15
2020-04-15 00:30:00,Tesla's Stock Keeps Rising After Goldman Sachs Gives Shares $864 Price Target,kaggle_analyst_analyst_ratings_processed.csv,2020-04-15,2020-04-15
2020-04-15 00:00:00,"Dow Jones Today, Futures Down On Oil Prices, Big Bank Earnings; Teladoc, Tesla Rally",massive_raw_partner_headlines,2020-04-15,2020-04-15
2020-04-15 00:00:00,"Dow Jones Futures: Coronavirus Stock Market Rally Faces Key Test Amid New Breakouts; Apple, Tesla Near Technical High",massive_raw_partner_headlines,2020-04-15,2020-04-15
2020-04-15 00:00:00,Tesla Makes a Comeback: ETFs to Ride On,massive_raw_partner_headlines,2020-04-15,2020-04-15
2020-04-15 00:00:00,"Cohen Klingenstein, LLC Buys ViacomCBS Inc, Tesla Inc, Sells ViacomCBS Inc, Vanguard FTSE ...",massive_raw_partner_headlines,2020-04-15,2020-04-15
2020-04-15 08:47:00,"'Choose Joplin,' A Missouri City Trying To Get Tesla To Build Gigafactory There, Offers $1B In Incentives",kaggle_analyst_analyst_ratings_processed.csv,2020-04-15,2020-04-15
2020-04-16 17:48:00,'California governor says ventilators promised by Elon Musk never made it to hospitals' -The Hill,kaggle_analyst_analyst_ratings_processed.csv,2020-04-16,2020-04-16
2020-04-16 17:55:00,Elon Musk Tweets Partial List Of Hospitals To Which Tesla Sent Ventilators,kaggle_analyst_analyst_ratings_processed.csv,2020-04-16,2020-04-16
2020-04-16 07:33:00,"CEO Elon Musk's 'Taking Tesla Private' Tweet Wasn't Merely 'Aspirational,' Judge Rules He Must Face Lawsuit",kaggle_analyst_analyst_ratings_processed.csv,2020-04-16,2020-04-16
2020-04-16 15:48:00,"Alibaba, Tesla Among Cramer's Stay-At-Home Stock Ideas",kaggle_analyst_analyst_ratings_processed.csv,2020-04-16,2020-04-16
2020-04-17 11:50:00,'Tesla angers Chinese buyers by rushing deliveries before the release of long range #Model3.' -China's National Business Daily,kaggle_analyst_analyst_ratings_processed.csv,2020-04-17,2020-04-17
2020-04-17 15:17:00,'Tesla completes massive expansion of its 'world's biggest battery' -Electrek,kaggle_analyst_analyst_ratings_processed.csv,2020-04-17,2020-04-17
2020-04-17 19:35:00,Ross Gerber Says Tesla Is Pushing Ahead Of Competitors During COVID-19 Pandemic,kaggle_analyst_analyst_ratings_processed.csv,2020-04-17,2020-04-17
2020-04-20 00:00:00,Tesla Share Can't Stop & Won't Stop,massive_raw_partner_headlines,2020-04-20,2020-04-20
2020-04-20 16:56:00,The Sound Of Electric Vehicles,kaggle_analyst_analyst_ratings_processed.csv,2020-04-20,2020-04-20
2020-04-21 00:00:00,"The Zacks Analyst Blog Highlights: Alphabet, Gilead Sciences, Starbucks, Tesla and Intuit",massive_raw_partner_headlines,2020-04-21,2020-04-21
2020-04-21 16:13:00,"Tesla shares are trading lower amid overall market weakness. Stocks across sectors are moving lower today after oil prices fell to lows, partially stemming from weak demand caused by the coronavirus pandemic.",kaggle_analyst_analyst_ratings_processed.csv,2020-04-21,2020-04-21
2020-04-22 13:22:00,"BofA Downgrades Tesla, Says Company 'Faces Several Hurdles'",kaggle_analyst_analyst_ratings_processed.csv,2020-04-22,2020-04-22
2020-04-22 11:54:00,"B of A Securities Downgrades Tesla to Underperform, Lowers Price Target to $485",kaggle_analyst_analyst_ratings_processed.csv,2020-04-22,2020-04-22
2020-04-22 11:40:00,Gene Munster Sees Apple And Tesla As Biggest Winners This Earnings Season,kaggle_analyst_analyst_ratings_processed.csv,2020-04-22,2020-04-22
2020-04-22 00:00:00,What's in the Offing for Tesla (TSLA) This Earnings Season?,massive_raw_partner_headlines,2020-04-22,2020-04-22
2020-04-22 00:00:00,"Dow Jones Futures: Coronavirus Stock Market Rally Powers Back; Apple, AMD, Tesla, Intel, Microsoft Near Buy Points, But Watch Out For This",massive_raw_partner_headlines,2020-04-22,2020-04-22
2020-04-22 00:00:00,"Kessler Investment Group, LLC Buys Occidental Petroleum Corp, Tesla Inc, Facebook Inc, Sells ...",massive_raw_partner_headlines,2020-04-22,2020-04-22
2020-04-23 00:00:00,5 Bargain Stocks Boasting Strikingly Low EV/EBITDA Ratios,massive_raw_partner_headlines,2020-04-23,2020-04-23
2020-04-23 10:07:00,United Therapeutics Reports Added Results From FREEDOM-EV Study Showing The Hemodynamic And Risk Status Reduction Benefits Of Orenitram Treatment In Patients With Pulmonary Arterial Hypertension,kaggle_analyst_analyst_ratings_processed.csv,2020-04-23,2020-04-23
2020-04-23 20:09:00,Tesla Appoints Hiromichi Mizuno As New Independent Director To Its Board,kaggle_analyst_analyst_ratings_processed.csv,2020-04-23,2020-04-23
2020-04-24 00:00:00,Will Solid Model 3/Y Sales Drive Tesla's (TSLA) Q1 Earnings?,massive_raw_partner_headlines,2020-04-24,2020-04-24
2020-04-24 00:00:00,"Thinking about trading options or stock in Eli Lilly, Square, Tesla, UnitedHealth Group, or ...",massive_raw_partner_headlines,2020-04-24,2020-04-24
2020-04-24 03:07:00,Tesla Appoints Japanese Pension Fund Manager Hiromichi Mizuno As Director,kaggle_analyst_analyst_ratings_processed.csv,2020-04-24,2020-04-24
2020-04-24 09:21:00,Tesla Raises China-made Model 3 Prices after EV Subsidies Cut,kaggle_analyst_analyst_ratings_processed.csv,2020-04-24,2020-04-24
2020-04-24 10:44:00,"'China extends new energy vehicle subsidy for two more years, but excludes premium models like Tesla's #Model3. Industry expects @Tesla to cut price to meet subsidy standards' -Tweet From China's National Business Daily",kaggle_analyst_analyst_ratings_processed.csv,2020-04-24,2020-04-24
2020-04-24 12:04:00,'NIO said Friday that it will cover the subsidy decline for buyers who pick up their cars before May 31. NIO is exempted from the price limit for subsidy qualification that excluded Model 3...' -Tweet From China's National Business Daily,kaggle_analyst_analyst_ratings_processed.csv,2020-04-24,2020-04-24
2020-04-24 21:08:00,The Benefits Of Electric Vehicles Are Clear As Day,kaggle_analyst_analyst_ratings_processed.csv,2020-04-24,2020-04-24
2020-04-27 16:41:00,Tesla Backtracks From Recalling Some Workers To Plant This Week,kaggle_analyst_analyst_ratings_processed.csv,2020-04-27,2020-04-27
2020-04-27 14:49:00,"Tesla shares are trading higher, potentially in anticipation of Q1 results this week. Not currently seeing company-specific news from the session.",kaggle_analyst_analyst_ratings_processed.csv,2020-04-27,2020-04-27
2020-04-27 03:41:00,Fremont Tesla Employees Asked To Go Back To Work Despite Coronavirus Health Orders In Place,kaggle_analyst_analyst_ratings_processed.csv,2020-04-27,2020-04-27
2020-04-27 13:28:00,'Tesla doubles down on claim Chinese EV startup stole its Autopilot source code' -Electrek,kaggle_analyst_analyst_ratings_processed.csv,2020-04-27,2020-04-27
2020-04-28 00:00:00,"Dow Jones 378-Point Intraday Gain Fades, But 3M A Bright Spot; Netflix, Tesla Weigh On Nasdaq",massive_raw_partner_headlines,2020-04-28,2020-04-28
2020-04-28 00:00:00,"Thinking about buying stock in Aurora Cannabis, Quest Diagnostics, Tesla, Petmed Express, or ...",massive_raw_partner_headlines,2020-04-28,2020-04-28
2020-04-28 03:46:00,Tesla Reverses Gear On Reopening Fremont Facility As Stay-At-Home Orders Likely To Be Extended,kaggle_analyst_analyst_ratings_processed.csv,2020-04-28,2020-04-28
2020-04-28 09:22:00,Tesla's Musk Nears $750M  Options Payday,kaggle_analyst_analyst_ratings_processed.csv,2020-04-28,2020-04-28
2020-04-28 11:57:00,Tesla Vehicles Will Now Recognize Traffic Lights And Stop Signs With Updated Software,kaggle_analyst_analyst_ratings_processed.csv,2020-04-28,2020-04-28
2020-04-28 15:49:00,'Tesla Is Working On Pay-As-You-Go Subscription To Its Self-Driving Package',kaggle_analyst_analyst_ratings_processed.csv,2020-04-28,2020-04-28
2020-04-28 18:54:00,Tesla Q1 Earnings Preview: Analysts Convinced Of Long-Term Potential Ahead Of The Print,kaggle_analyst_analyst_ratings_processed.csv,2020-04-28,2020-04-28
2020-04-28 18:57:00,'Electric vehicles are taking over sales charts in Europe and the @Tesla Model 3 has been leading the way' -Inside EVs,kaggle_analyst_analyst_ratings_processed.csv,2020-04-28,2020-04-28
2020-04-29 20:16:00,Tesla Q1 Total Deliveries Up 40% YoY,kaggle_analyst_analyst_ratings_processed.csv,2020-04-29,2020-04-29
2020-04-29 20:16:00,"Tesla Says Reached Production Of 1,000 Solar Roofs In A Single Week",kaggle_analyst_analyst_ratings_processed.csv,2020-04-29,2020-04-29
2020-04-29 20:18:00,UPDATE: Tesla Says 'we will achieve industry leading operating margins and profitability with capacity expansion and localization plans underway',kaggle_analyst_analyst_ratings_processed.csv,2020-04-29,2020-04-29
2020-04-29 20:18:00,Tesla Says Near-Term Profitability Is On Hold,kaggle_analyst_analyst_ratings_processed.csv,2020-04-29,2020-04-29
2020-04-29 20:19:00,"Tesla Says Continues To Build Capacity For Model Y At Gigafactorys In Berlin, Shanghai, Remain On Track To Start Deliveries From Both Locations In 2021",kaggle_analyst_analyst_ratings_processed.csv,2020-04-29,2020-04-29
2020-04-29 16:14:00,Tesla Considering Cutting Price Of Model 3 In China To Regain Access To Incentives,kaggle_analyst_analyst_ratings_processed.csv,2020-04-29,2020-04-29
2020-04-29 20:20:00,Tesla Says Will Shift First Tesla Semi Deliveries To 2021,kaggle_analyst_analyst_ratings_processed.csv,2020-04-29,2020-04-29
2020-04-29 20:30:00,"Tesla Reports Big Q1 Earnings Beat, Near-Term Profitability 'On Hold'",kaggle_analyst_analyst_ratings_processed.csv,2020-04-29,2020-04-29
2020-04-29 20:34:00,Tesla shares are trading higher after the company reported better-than-expected Q1 EPS and sales results. The company also reported Q1 Model S/X production was up 9% year over year and Model 3/Y product was up 39% year over year.,kaggle_analyst_analyst_ratings_processed.csv,2020-04-29,2020-04-29
2020-04-29 23:10:00,From Conference Call: Tesla CEO Says Might Announce Next Gigafactory in 1-3 Months in the U.S.,kaggle_analyst_analyst_ratings_processed.csv,2020-04-29,2020-04-29
2020-04-29 23:42:00,Elon Musk Calls Bay Area's Shelter-In-Place Order 'Fascist' In Vulgar Conference Call Rant,kaggle_analyst_analyst_ratings_processed.csv,2020-04-29,2020-04-29
2020-04-29 20:15:00,Tesla Sees Capacity Installed Exceeding 500K Vehicles Delivered In 2020,kaggle_analyst_analyst_ratings_processed.csv,2020-04-29,2020-04-29
2020-04-29 20:19:00,"Tesla Says Sees Production Of Model Y In Fremont, California, Model 3 In Shanghai, China Continuing To Ramp 'Gradually' Through Q2",kaggle_analyst_analyst_ratings_processed.csv,2020-04-29,2020-04-29
2020-04-29 20:15:00,"Tesla Q1 Model S/X Production Up 9% YoY, Model 3/Y Production Up 39% YoY",kaggle_analyst_analyst_ratings_processed.csv,2020-04-29,2020-04-29
2020-04-29 14:45:00,Ford Terminates Electric Vehicle Program With Rivian,kaggle_analyst_analyst_ratings_processed.csv,2020-04-29,2020-04-29
2020-04-29 20:14:00,"Tesla Says Model Y Deliveries Began, Significantly Ahead Of Schedule",kaggle_analyst_analyst_ratings_processed.csv,2020-04-29,2020-04-29
2020-04-29 00:00:00,Dow Jones Futures: Tesla Leads Tech Titans In Buy Zones As Coronavirus Stock Market Rally Roars,massive_raw_partner_headlines,2020-04-29,2020-04-29
2020-04-29 13:02:00,What Nio's Nearly $1B Financing Deal Means For The Chinese EV Manufacturer,kaggle_analyst_analyst_ratings_processed.csv,2020-04-29,2020-04-29
2020-04-29 13:04:00,Tesla shares are trading higher potentially in anticipation of the company Q1 earnings report.,kaggle_analyst_analyst_ratings_processed.csv,2020-04-29,2020-04-29
2020-04-29 13:15:00,3 ETFs For Tesla Earnings,kaggle_analyst_analyst_ratings_processed.csv,2020-04-29,2020-04-29
2020-04-29 13:18:00,'Free America Now': Tesla CEO Elon Musk Calls For Reopening Economy Despite Pandemic,kaggle_analyst_analyst_ratings_processed.csv,2020-04-29,2020-04-29
2020-04-29 10:52:00,Tesla Reveals How Much Business It Has Done With Elon Musk's Other Company SpaceX Since 2019,kaggle_analyst_analyst_ratings_processed.csv,2020-04-29,2020-04-29
2020-04-29 13:46:00,Tesla Shares Up 2.3% For Session But Down Sharply After Touching $800 Level; Hearing M Science Sees Reservations For Tesla Models Down 65.8% From Last Qtr.,kaggle_analyst_analyst_ratings_processed.csv,2020-04-29,2020-04-29
2020-04-29 20:15:00,Tesla Says Will Revisit Outlook When Co. Gives Q2 Earnings/Update,kaggle_analyst_analyst_ratings_processed.csv,2020-04-29,2020-04-29
2020-04-29 17:43:00,Hedge Fund Manager Makes Bold Tesla Prediction Ahead Of Earnings,kaggle_analyst_analyst_ratings_processed.csv,2020-04-29,2020-04-29
2020-04-29 19:26:00,JMP Analyst Sees Tesla Coming Out Of Crisis Stronger,kaggle_analyst_analyst_ratings_processed.csv,2020-04-29,2020-04-29
2020-04-29 20:14:00,"Tesla Q1 Adj. EPS $1.240 Beats $(0.360) Estimate, Sales $5.985B Beat $5.900B Estimate",kaggle_analyst_analyst_ratings_processed.csv,2020-04-29,2020-04-29
2020-04-29 13:34:00,"Tesla's 500,000-Vehicle Target In Question After Company Shuts Factories",kaggle_analyst_analyst_ratings_processed.csv,2020-04-29,2020-04-29
2020-04-30 11:53:00,Tesla shares are trading higher after the company reported better-than-expected Q1 EPS and sales results. The company also reported Q1 Model S/X production was up 9% year over year and Model 3/Y product was up 39% year over year.,kaggle_analyst_analyst_ratings_processed.csv,2020-04-30,2020-04-30
2020-04-30 19:01:00,7 Times Elon Musk Wasn't Afraid To Speak His Mind,kaggle_analyst_analyst_ratings_processed.csv,2020-04-30,2020-04-30
2020-04-30 17:34:00,Earlier Bloomberg Article Highlights Greenlight's Einhorn Questioning Tesla's Billing Practices,kaggle_analyst_analyst_ratings_processed.csv,2020-04-30,2020-04-30
2020-04-30 17:04:00,'Jeff Bezos and Elon Musk win contracts for spacecraft to land NASA astronauts on the moon',kaggle_analyst_analyst_ratings_processed.csv,2020-04-30,2020-04-30
2020-04-30 16:57:00,"Tesla Analysts Break Down Free Cash Flow, Fremont Shutdown, 2020 Expectations After Q1 Print",kaggle_analyst_analyst_ratings_processed.csv,2020-04-30,2020-04-30
2020-04-30 16:20:00,'Elon Musk: one of the most exciting days in Tesla history is coming – hints at 'Terafactory'' -Electrek,kaggle_analyst_analyst_ratings_processed.csv,2020-04-30,2020-04-30
2020-04-30 13:26:00,"Oppenheimer Maintains Outperform on Tesla, Raises Price Target to $968",kaggle_analyst_analyst_ratings_processed.csv,2020-04-30,2020-04-30
